{
  "event_id": "rbc_news:123456",
  "event_type": "preprocessed",
  "event_timestamp": "2026-01-31T14:23:47.200Z",
  "event_version": "v1.0.0",
  "source_system": "preprocessor",
  "trace_id": "550e8400-e29b-41d4-a716-446655440000",
  "payload": {
    "message_id": 123456,
    "channel": "rbc_news",
    "original_text": "Центробанк повысил ключевую ставку до 18% на фоне роста инфляции. Решение было принято на заседании совета директоров ЦБ РФ.",
    "cleaned_text": "центробанк повысил ключевую ставку до 18% на фоне роста инфляции решение было принято на заседании совета директоров цб рф",
    "normalized_text": "центробанк повысить ключевой ставка до 18% на фон рост инфляция решение быть принять на заседание совет директор цб рф",
    "language": "ru",
    "tokens": [
      "центробанк",
      "повысил",
      "ключевую",
      "ставку",
      "до",
      "18%",
      "на",
      "фоне",
      "роста",
      "инфляции",
      "решение",
      "было",
      "принято",
      "на",
      "заседании",
      "совета",
      "директоров",
      "цб",
      "рф"
    ],
    "sentences_count": 2,
    "word_count": 19,
    "has_urls": false,
    "has_mentions": false,
    "has_hashtags": false,
    "urls": [],
    "mentions": [],
    "hashtags": [],
    "preprocessing_metadata": {
      "version": "1.0.0",
      "timestamp": "2026-01-31T14:23:47.200Z",
      "duration_ms": 45.2
    }
  }
}
